{
  "$schema": "https://json-schema.org/draft/2020-12/schema",
  "title": "SARIF External Property File Schema Version 2.2 JSON Schema",
  "$id": "https://docs.oasis-open.org/sarif/sarif/v2.2/schema/sarif-external-property-file.json",
  "type": "object",
  "properties": {
    "$schema": {
      "description": "The URI of the JSON schema corresponding to the version of the external property file format.",
      "type": "string",
      "format": "uri"
    },
    "version": {
      "description": "The SARIF format version of this external properties object.",
      "enum": [
        "2.2"
      ]
    },
    "guid": {
      "description": "A stable, unique identifier for this external properties object, in the form of a GUID.",
      "type": "string",
      "pattern": "^[0-9a-fA-F]{8}-[0-9a-fA-F]{4}-[1-5][0-9a-fA-F]{3}-[89abAB][0-9a-fA-F]{3}-[0-9a-fA-F]{12}$"
    },
    "runGuid": {
      "description": "A stable, unique identifier for the run associated with this external properties object, in the form of a GUID.",
      "type": "string",
      "pattern": "^[0-9a-fA-F]{8}-[0-9a-fA-F]{4}-[1-5][0-9a-fA-F]{3}-[89abAB][0-9a-fA-F]{3}-[0-9a-fA-F]{12}$"
    },
    "conversion": {
      "description": "A conversion object that will be merged with an external run.",
      "$ref": "sarif.json#/$defs/conversion"
    },
    "graphs": {
      "description": "An array of graph objects that will be merged with an external run.",
      "type": "array",
      "minItems": 0,
      "default": [],
      "uniqueItems": true,
      "items": {
        "$ref": "sarif.json#/$defs/graph"
      }
    },
    "externalizedProperties": {
      "description": "Key/value pairs that provide additional information that will be merged with an external run.",
      "$ref": "sarif.json#/$defs/propertyBag"
    },
    "artifacts": {
      "description": "An array of artifact objects that will be merged with an external run.",
      "type": "array",
      "minItems": 0,
      "uniqueItems": true,
      "items": {
        "$ref": "sarif.json#/$defs/artifact"
      }
    },
    "invocations": {
      "description": "Describes the invocation of the analysis tool that will be merged with an external run.",
      "type": "array",
      "minItems": 0,
      "uniqueItems": false,
      "default": [],
      "items": {
        "$ref": "sarif.json#/$defs/invocation"
      }
    },
    "logicalLocations": {
      "description": "An array of logical locations such as namespaces, types or functions that will be merged with an external run.",
      "type": "array",
      "minItems": 0,
      "uniqueItems": true,
      "default": [],
      "items": {
        "$ref": "sarif.json#/$defs/logicalLocation"
      }
    },
    "threadFlowLocations": {
      "description": "An array of threadFlowLocation objects that will be merged with an external run.",
      "type": "array",
      "minItems": 0,
      "uniqueItems": true,
      "default": [],
      "items": {
        "$ref": "sarif.json#/$defs/threadFlowLocation"
      }
    },
    "results": {
      "description": "An array of result objects that will be merged with an external run.",
      "type": "array",
      "minItems": 0,
      "uniqueItems": false,
      "default": [],
      "items": {
        "$ref": "sarif.json#/$defs/result"
      }
    },
    "taxonomies": {
      "description": "Tool taxonomies that will be merged with an external run.",
      "type": "array",
      "minItems": 0,
      "uniqueItems": true,
      "default": [],
      "items": {
        "$ref": "sarif.json#/$defs/toolComponent"
      }
    },
    "driver": {
      "description": "The analysis tool object that will be merged with an external run.",
      "$ref": "sarif.json#/$defs/toolComponent"
    },
    "extensions": {
      "description": "Tool extensions that will be merged with an external run.",
      "type": "array",
      "minItems": 0,
      "uniqueItems": true,
      "default": [],
      "items": {
        "$ref": "sarif.json#/$defs/toolComponent"
      }
    },
    "policies": {
      "description": "Tool policies that will be merged with an external run.",
      "type": "array",
      "minItems": 0,
      "uniqueItems": true,
      "default": [],
      "items": {
        "$ref": "sarif.json#/$defs/toolComponent"
      }
    },
    "translations": {
      "description": "Tool translations that will be merged with an external run.",
      "type": "array",
      "minItems": 0,
      "uniqueItems": true,
      "default": [],
      "items": {
        "$ref": "sarif.json#/$defs/toolComponent"
      }
    },
    "addresses": {
      "description": "Addresses that will be merged with with an external run.",
      "type": "array",
      "minItems": 0,
      "uniqueItems": false,
      "default": [],
      "items": {
        "$ref": "sarif.json#/$defs/address"
      }
    },
    "webRequests": {
      "description": "Requests that will be merged with an external run.",
      "type": "array",
      "minItems": 0,
      "uniqueItems": true,
      "default": [],
      "items": {
        "$ref": "sarif.json#/$defs/webRequest"
      }
    },
    "webResponses": {
      "description": "Responses that will be merged with an external run.",
      "type": "array",
      "minItems": 0,
      "uniqueItems": true,
      "default": [],
      "items": {
        "$ref": "sarif.json#/$defs/webResponse"
      }
    },
    "properties": {
      "description": "Key/value pairs that provide additional information about the external properties.",
      "$ref": "sarif.json#/$defs/propertyBag"
    }
  },
  "required": [
    "version"
  ],
  "additionalProperties": false
}
