{
  "version": "2.2",
  "$schema": "https://docs.oasis-open.org/sarif/sarif/v2.2/schema/sarif-external-property-file.json",
  "guid": "00001111-2222-1111-8888-555566667777",
  "runGuid": "88889999-AAAA-1111-8888-DDDDEEEEFFFF",
  "artifacts": [
    {
      "location": {
        "uri": "apple.png"
      },
      "mimeType": "image/png"
    },
    {
      "location": {
        "uri": "banana.png"
      },
      "mimeType": "image/png"
    }
  ],
  "externalizedProperties": {
    "team": "Security Assurance Team"
  }
}
